{
  "schema": "1.0",
  "price_min_inr": 15,
  "price_max_inr": 5000,
  "eta_max_min": 60,
  "road_factor": 1.35,
  "base_allowance_inr": 60,
  "per_km_inr": {
    "bike": [
      3,
      30
    ],
    "auto": [
      8,
      45
    ],
    "cab_economy": [
      8,
      60
    ],
    "cab_premium": [
      10,
      90
    ],
    "cab_xl": [
      12,
      110
    ],
    "other": [
      3,
      150
    ]
  }
}
